{
  "$schema": "https://json-schema.org/draft/2020-12/schema",
  "$id": "https://raw.githubusercontent.com/Shuiei/valheim-world-editor/main/docs/worldeditor.schema.json",
  "title": "Valheim World Editor mod manifest (worldeditor.json)",
  "description": "What a Valheim mod tells the Valheim World Editor about itself. See docs/modding.md.",
  "type": "object",
  "required": ["version"],
  "properties": {
    "$schema": { "type": "string" },
    "version": { "const": 1, "description": "The format's version." },
    "data": {
      "type": "object",
      "description": "By data key, as the mod's code names it.",
      "additionalProperties": {
        "type": "object",
        "properties": {
          "label": { "$ref": "#/$defs/text", "description": "How the inspector names the value." },
          "readOnly": { "type": "boolean", "description": "The inspector shows the value but does not let it be changed." },
          "help": { "$ref": "#/$defs/text", "description": "What the value is, shown when pointing at it." }
        },
        "additionalProperties": false
      }
    },
    "extension": { "$ref": "#/$defs/text", "pattern": "\\.dll$", "description": "The mod's editor extension: a DLL, relative to this file's folder and inside it. Runs once the player allows it (Settings, Mod extensions); an add-on's runs as installed." },
    "serves": { "$ref": "#/$defs/text", "pattern": "^[^/\\\\]+\\.[dD][lL][lL]$", "description": "An add-on's only (a file in the addons folder next to the editor): the file name of the mod's DLL it is for. The add-on is used while that DLL is in a plugins folder; without it, always." },
    "gameComponents": {
      "type": "array",
      "maxItems": 32,
      "description": "Class names of the game's scripts whose fields the extension reads (IEditorHost.Game): read from the player's Valheim while the extension runs.",
      "items": { "type": "string", "pattern": "^[A-Za-z_][A-Za-z0-9_]{0,99}$" }
    },
    "links": {
      "type": "array",
      "description": "How the mod links its objects into one (a ship and its pieces): each rule's keys are data keys, as the mod's code names them.",
      "items": {
        "type": "object",
        "required": ["id", "parents", "offset"],
        "properties": {
          "name": { "$ref": "#/$defs/text", "description": "What one group is called in the editor's messages (default: group)." },
          "id": { "$ref": "#/$defs/text", "description": "Int data key of an object's own id, which its parts name." },
          "parents": { "$ref": "#/$defs/keys", "minItems": 1, "description": "Int data keys naming what a part hangs on, the first one set winning." },
          "offset": { "$ref": "#/$defs/text", "description": "Vec3 data key of a part's place in the frame of what it hangs on, in metres." },
          "rotation": { "$ref": "#/$defs/text", "description": "Vec3 data key of a part's turn in that frame, Unity Euler degrees." },
          "rotationQuaternion": { "$ref": "#/$defs/text", "description": "Quaternion data key of that turn, used when rotation is not stored." },
          "storedAt": { "enum": ["root", "own"], "description": "Where the game saves a part: at its group's root (default) or where it stands." },
          "references": { "$ref": "#/$defs/keys", "description": "Other int data keys naming an object's id: a pasted copy's follow the new ids." },
          "dropOnCopy": { "$ref": "#/$defs/keys", "description": "Data keys a pasted copy leaves out." }
        },
        "additionalProperties": false
      }
    },
    "prefabs": {
      "type": "object",
      "description": "By prefab name.",
      "additionalProperties": {
        "type": "object",
        "properties": {
          "hidden": { "type": "boolean", "description": "Not offered in Place or the Workshop's Build panel." },
          "group": { "$ref": "#/$defs/text", "description": "The heading the piece is listed under in the Build panel's Mods tab." },
          "data": { "type": "boolean", "description": "Objects of it only hold the mod's data: never drawn, picked or listed, kept by a zone reset that keeps the buildings." }
        },
        "additionalProperties": false
      }
    }
  },
  "$defs": {
    "text": { "type": "string", "minLength": 1, "maxLength": 200 },
    "keys": { "type": "array", "maxItems": 32, "items": { "$ref": "#/$defs/text" } }
  }
}
