{
  "$schema": "https://raw.githubusercontent.com/Shuiei/valheim-world-editor/main/docs/worldeditor.schema.json",
  "version": 1,
  "extension": "ExampleVehicles.WorldEditor.dll",
  "gameComponents": ["Ship"],
  "data": {
    "ExampleVehicles_Vehicle": { "label": "Vehicle", "readOnly": true, "help": "The vehicle this part is built on." },
    "ExampleVehicles_Offset": { "label": "Place on the vehicle", "readOnly": true },
    "ExampleVehicles_Packed": { "label": "Linked objects", "help": "The objects this one is tied to." }
  },
  "prefabs": {
    "example_boundary": { "hidden": true },
    "example_fleet": { "hidden": true, "data": true },
    "example_canal": { "hidden": true, "data": true },
    "example_hull": { "group": "Hulls" },
    "example_sail": { "group": "Sails and cables" },
    "example_post": { "group": "Sails and cables" },
    "example_pit": { "group": "Digging" }
  },
  "links": [
    {
      "name": "vehicle",
      "id": "ExampleVehicles_Id",
      "parents": ["ExampleVehicles_Mount", "ExampleVehicles_Vehicle"],
      "offset": "ExampleVehicles_Offset",
      "rotation": "ExampleVehicles_Turn",
      "rotationQuaternion": "ExampleVehicles_TurnQ",
      "storedAt": "root",
      "references": ["ExampleVehicles_Target", "ExampleVehicles_Drives"],
      "dropOnCopy": ["ExampleVehicles_Packed", "ExampleVehicles_Aboard"]
    }
  ]
}
